{
  "access_policies": [
    {
      "resource_type": "example-value"
    }
  ],
  "access_token_ttl_in_ms": 15000,
  "enabled": true,
  "id": "6207d123-d123-0b5c-5fa1-95fabc5c7123",
  "issuer": "https://purestorage.idp.okta.com",
  "key_id": "6207d123-d123-0b5c-5fa1-95fabc5c7123",
  "max_role": "storage_admin",
  "name": "NightlyStatsAggregationScript",
  "public_key": "-----BEGIN PUBLIC KEY-----\nMIICIjANBgkqhkiG9w0BAQEFAAOCAg8AMIICCgKCAgEArSe6chh1JzME9svOKjU0\neKTm8S23Ok3Vr2bWuPri/YHfLrlnRwWoCt+st0/BebKSJ+fQUWOaLlqpZQKpI8oR\ngJ9sWmwGibVG8cTuz7XMkskx9bsm/bjIenuB4W+s3g0BCsi9930mfdKgJgFzY69O\nnLh7d7hAFcmhSJa945PryQZpvJ/U4Ue5F4d+WXgEJ0SoSRaZ6bbeMPhcbMHTzTum\n2ZrPBkK5cqPYitaso6BXeAlqNQPw4Kbu4Ugm0CTogrtImkwoonWDDP34XMOq+u7q\nsNTbJSvDKMTM1RPPrTWCaLiuZkdLVEVesZ9/8+XUMIgBTElwQJDCAQer03MJzqRr\n1eCZGgLfDuYqwMG2MFaAX7kgqBwwyqRTd6MxaQxt2nkdfwiXSY71llzEQ23g3T+1\n64zjwAL5f+dtu8PkGF7IdU2T8P2Qk9bG9pckwZHWYkBK77BAk5jbmSzsKGZgRb2R\n1E+TWDKIaveFhQp251j/C5wkZwMXgjOzN+BOPo+OiLBGUl+jRybWA9f7Vq1MEdf6\nSEdLiqYrXcZERkYBMieLXAfdtaztAIb96cUu+OKMSLDk+D0GHkUfm7lEbDK3ew1+\nD6z+BnxDyH6oqZzz4lS2kPLBLsc+6pdTGuKLf0S9YuLiqJe659AdwU8+X/3KtwNd\nFVJSaxdFbWx0nj3hJqFkIO8CAwEAAQ==\n-----END PUBLIC KEY-----\n"
}